{"$id":"https://moving-origin-research.invalid/schemas/m4-model-custody-record-v1","$schema":"https://json-schema.org/draft/2020-12/schema","additionalProperties":false,"properties":{"candidate_peer_identity_equal":{"type":"boolean"},"date":{"const":"2026-08-21"},"failure_code":{"anyOf":[{"type":"null"},{"enum":["CHECKPOINT_IDENTITY_MISMATCH","UNAPPROVED_MODEL_ARTIFACT","LICENSE_NOT_ACCEPTED","LOCAL_ONLY_CUSTODY_VIOLATION"]}]},"files":{"items":{"additionalProperties":false,"properties":{"bytes":{"minimum":1,"type":"integer"},"class":{"enum":["WEIGHT","TOKENIZER","CONFIG","LICENSE","DOCUMENTATION","GIT_METADATA"]},"name":{"type":"string"},"ordinal":{"minimum":0,"type":"integer"},"sha256":{"pattern":"^[0-9a-f]{64}$"},"verified":{"type":"boolean"}},"required":["ordinal","name","bytes","sha256","class","verified"],"type":"object"},"minItems":1,"type":"array"},"license_id":{"type":"string"},"license_source_url":{"format":"uri"},"logical_artifact_id":{"type":"string"},"regime":{"const":"B"},"repository_id":{"type":"string"},"revision":{"pattern":"^[0-9a-f]{40}$"},"schema_version":{"const":"m4-model-custody-record-v1"},"status":{"enum":["PASS","FAIL","BLOCKED"]},"verified_utc":{"format":"date-time"}},"required":["schema_version","date","regime","logical_artifact_id","repository_id","revision","license_id","license_source_url","verified_utc","files","candidate_peer_identity_equal","status","failure_code"],"title":"M4 sanitized model custody record v1","type":"object","x-artifact-date":"2026-08-21","x-artifact-regime":"B","x-source-class":"PROPOSED"}
