{"candidate_peer_identity_equal":true,"date":"2026-08-21","failure_code":null,"files":[{"bytes":5190053264,"class":"WEIGHT","name":"model.safetensors","ordinal":0,"sha256":"b6154d74332140fd6dfbfbe70bbb3650dd6955861132bd59dda6789e6322b485","verified":true}],"license_id":"Apache-2.0","license_source_url":"https://huggingface.co/Qwen/Qwen3-4B-Instruct-2507-FP8/blob/8591804019c8b22094c3b5b4454e0edc05dffc98/LICENSE","logical_artifact_id":"PRIMARY_QWEN3_4B_FP8","regime":"B","repository_id":"Qwen/Qwen3-4B-Instruct-2507-FP8","revision":"8591804019c8b22094c3b5b4454e0edc05dffc98","schema_version":"m4-model-custody-record-v1","status":"PASS","verified_utc":"2026-08-21T00:00:00Z"}
